{
  "family_coverage": {
    "adjacent_repo_evidence": {
      "completion_claim": "inventory-only-no-completeness-claim",
      "fallback_source_ids": [],
      "primary_source_ids": []
    },
    "audio_reporting": {
      "completion_claim": "inventory-only-no-completeness-claim",
      "fallback_source_ids": [
        "rnz-parliament",
        "parliament-today-am-network"
      ],
      "primary_source_ids": []
    },
    "broadcast_archive": {
      "completion_claim": "inventory-only-no-completeness-claim",
      "fallback_source_ids": [
        "tvnz-archive-looking-back",
        "nga-taonga-av-collection",
        "archives-new-zealand-av-catalogue"
      ],
      "primary_source_ids": []
    },
    "house_video": {
      "completion_claim": "inventory-only-no-completeness-claim",
      "fallback_source_ids": [],
      "primary_source_ids": [
        "official-parliament-video",
        "official-parliament-live-and-recorded",
        "parliament-on-demand-house-archive"
      ]
    },
    "parliament_website_embeds": {
      "completion_claim": "inventory-only-no-completeness-claim",
      "fallback_source_ids": [],
      "primary_source_ids": [
        "parliament-website-embedded-video-pages",
        "parliament-site-search-and-sitemaps"
      ]
    },
    "select_committee_video": {
      "completion_claim": "inventory-only-no-completeness-claim",
      "fallback_source_ids": [],
      "primary_source_ids": [
        "select-committee-on-demand-archive",
        "select-committee-live-streams-current",
        "select-committee-vimeo-pages"
      ]
    },
    "social_video_platform": {
      "completion_claim": "inventory-only-no-completeness-claim",
      "fallback_source_ids": [],
      "primary_source_ids": [
        "official-youtube-nz-parliament"
      ]
    },
    "web_archive": {
      "completion_claim": "inventory-only-no-completeness-claim",
      "fallback_source_ids": [
        "internet-archive-webcaptures",
        "memento-cdx-web-archives"
      ],
      "primary_source_ids": []
    }
  },
  "generated_at": "2026-07-05",
  "inventory_status": "source-inventory",
  "manifest_version": 1,
  "next_track": "parliament_video_seed_fetchers_20260705",
  "policy": {
    "fallbacks_are_validation_only": true,
    "metadata_first": true,
    "no_audio_file_download": true,
    "no_completeness_claim": true,
    "no_media_download": true,
    "no_public_media_release": true,
    "no_video_file_download": true,
    "rights_review_required_before_media_acquisition": true
  },
  "repository": "corpus-nz-hansard",
  "source_summary": {
    "fallback_ids_by_role": {
      "audio_or_reporting_validation": [
        "rnz-parliament",
        "parliament-today-am-network"
      ],
      "boundary_evidence": [
        "adjacent-sm-govt-nz",
        "adjacent-hathi-nz",
        "adjacent-corpus-law-nz"
      ],
      "catalogue_validation": [
        "nga-taonga-av-collection",
        "archives-new-zealand-av-catalogue"
      ],
      "historical_broadcast_validation": [
        "tvnz-archive-looking-back"
      ],
      "link_rot_validation": [
        "internet-archive-webcaptures",
        "memento-cdx-web-archives"
      ]
    },
    "fallback_source_count": 7,
    "fallback_source_ids": [
      "tvnz-archive-looking-back",
      "nga-taonga-av-collection",
      "rnz-parliament",
      "parliament-today-am-network",
      "archives-new-zealand-av-catalogue",
      "internet-archive-webcaptures",
      "memento-cdx-web-archives"
    ],
    "official_source_count": 9,
    "official_source_ids": [
      "official-parliament-video",
      "official-parliament-live-and-recorded",
      "official-youtube-nz-parliament",
      "parliament-on-demand-house-archive",
      "select-committee-on-demand-archive",
      "select-committee-live-streams-current",
      "select-committee-vimeo-pages",
      "parliament-website-embedded-video-pages",
      "parliament-site-search-and-sitemaps"
    ],
    "source_count": 19,
    "supporting_source_count": 3
  },
  "sources": [
    {
      "access_method": "metadata_probe_required",
      "acquisition_boundary": "metadata_only_no_media_download",
      "archive_status": "external_source_identified",
      "evidence_urls": [
        "https://videos.parliament.nz/"
      ],
      "expected_date_range": "Current Parliament video platform; exact start date to be probed.",
      "fallback_role": "not_fallback",
      "known_blockers": [
        "no local inventory count yet"
      ],
      "media_types": [
        "video",
        "audio",
        "metadata"
      ],
      "metadata_availability": "video page metadata, search metadata, and possible API responses",
      "platform_class": "official_parliament_video",
      "publisher": "New Zealand Parliament",
      "rights_status": "rights_review_required",
      "source_family": "house_video",
      "source_id": "official-parliament-video",
      "source_role": "official",
      "title": "Official Parliament Video platform",
      "url": "https://videos.parliament.nz/"
    },
    {
      "access_method": "metadata_probe_required",
      "acquisition_boundary": "metadata_only_no_media_download",
      "archive_status": "external_source_identified",
      "evidence_urls": [
        "https://www.parliament.nz/"
      ],
      "expected_date_range": "Current Parliament website navigation and Parliament in action video links.",
      "fallback_role": "not_fallback",
      "known_blockers": [
        "no local inventory count yet"
      ],
      "media_types": [
        "video",
        "audio",
        "metadata"
      ],
      "metadata_availability": "site navigation, live video links, and recorded-video links",
      "platform_class": "official_parliament_website",
      "publisher": "New Zealand Parliament",
      "rights_status": "rights_review_required",
      "source_family": "house_video",
      "source_id": "official-parliament-live-and-recorded",
      "source_role": "official",
      "title": "Parliament website live and recorded video surface",
      "url": "https://www.parliament.nz/"
    },
    {
      "access_method": "metadata_probe_required",
      "acquisition_boundary": "metadata_only_no_media_download",
      "archive_status": "external_source_identified",
      "evidence_urls": [
        "https://www.youtube.com/channel/UCuPya3mH6P9grNmgzmVdxoQ"
      ],
      "expected_date_range": "Public channel video range; exact earliest upload to be probed.",
      "fallback_role": "not_fallback",
      "known_blockers": [
        "YouTube API quota or page access constraints"
      ],
      "media_types": [
        "video",
        "audio",
        "metadata"
      ],
      "metadata_availability": "channel, playlist, video, livestream, and upload metadata",
      "platform_class": "youtube",
      "publisher": "New Zealand Parliament",
      "rights_status": "platform_terms_review_required",
      "source_family": "social_video_platform",
      "source_id": "official-youtube-nz-parliament",
      "source_role": "official",
      "title": "Official NZ Parliament YouTube channel",
      "url": "https://www.youtube.com/channel/UCuPya3mH6P9grNmgzmVdxoQ/videos"
    },
    {
      "access_method": "metadata_probe_required",
      "acquisition_boundary": "metadata_only_no_media_download",
      "archive_status": "external_source_identified",
      "evidence_urls": [
        "https://ondemand.parliament.nz/"
      ],
      "expected_date_range": "House live and on-demand handoff surface; previous site redirects current viewing to Parliament Video.",
      "fallback_role": "not_fallback",
      "known_blockers": [
        "no local inventory count yet"
      ],
      "media_types": [
        "video",
        "audio",
        "metadata"
      ],
      "metadata_availability": "legacy page metadata and handoff links",
      "platform_class": "parliament_on_demand",
      "publisher": "New Zealand Parliament",
      "rights_status": "rights_review_required",
      "source_family": "house_video",
      "source_id": "parliament-on-demand-house-archive",
      "source_role": "official",
      "title": "Parliament On Demand house video archive",
      "url": "https://ondemand.parliament.nz/"
    },
    {
      "access_method": "metadata_probe_required",
      "acquisition_boundary": "metadata_only_no_media_download",
      "archive_status": "external_source_identified",
      "evidence_urls": [
        "https://ondemand.parliament.nz/select-committees"
      ],
      "expected_date_range": "52nd and 53rd Parliament select committee videos according to the archive page.",
      "fallback_role": "not_fallback",
      "known_blockers": [
        "no local inventory count yet"
      ],
      "media_types": [
        "video",
        "audio",
        "metadata"
      ],
      "metadata_availability": "filterable committee/date/parliament metadata",
      "platform_class": "parliament_on_demand",
      "publisher": "New Zealand Parliament",
      "rights_status": "rights_review_required",
      "source_family": "select_committee_video",
      "source_id": "select-committee-on-demand-archive",
      "source_role": "official",
      "title": "Select Committees On Demand archive",
      "url": "https://ondemand.parliament.nz/select-committees"
    },
    {
      "access_method": "metadata_probe_required",
      "acquisition_boundary": "metadata_only_no_media_download",
      "archive_status": "external_source_identified",
      "evidence_urls": [
        "https://www3.parliament.nz/en/pb/sc/watch-select-committee-live-streams/"
      ],
      "expected_date_range": "Current 54th Parliament select committee livestream and archive links.",
      "fallback_role": "not_fallback",
      "known_blockers": [
        "no local inventory count yet"
      ],
      "media_types": [
        "video",
        "audio",
        "metadata"
      ],
      "metadata_availability": "committee livestream pages and linked archive pages",